[
	{
		"id": "hutao",
		"name": "Hu Tao",
		"game": "Genshin Impact",
		"releaseDate": "2021-03-02",
		"rarity": "SSR",
		"gender": "Female",
		"species": { "type": "Human", "sub": "" },
		"hairColor": "Multicolor",
		"eyeColor": "Red",
		"heightCategory": "Short",
		"outfitColor": "Black",
		"affiliation": "Liyue",
		"voiceActorJP": "Nao Toyama"
	},
	{
		"id": "zhongli",
		"name": "Zhongli",
		"game": "Genshin Impact",
		"releaseDate": "2020-12-01",
		"rarity": "SSR",
		"gender": "Male",
		"species": { "type": "Fantasy", "sub": "Archon" },
		"hairColor": "Brown",
		"eyeColor": "Yellow",
		"heightCategory": "Tall",
		"outfitColor": "Brown",
		"affiliation": "Liyue",
		"voiceActorJP": "Tomoaki Maeno"
	},
	{
		"id": "venti",
		"name": "Venti",
		"game": "Genshin Impact",
		"releaseDate": "2020-09-28",
		"rarity": "SSR",
		"gender": "Male",
		"species": { "type": "Fantasy", "sub": "Archon" },
		"hairColor": "Green",
		"eyeColor": "Blue",
		"heightCategory": "Short",
		"outfitColor": "Multicolor",
		"affiliation": "Mondstadt",
		"voiceActorJP": "Ayumu Murase"
	},
	{
		"id": "bennett",
		"name": "Bennett",
		"game": "Genshin Impact",
		"releaseDate": "2020-09-28",
		"rarity": "SR",
		"gender": "Male",
		"species": { "type": "Human", "sub": "" },
		"hairColor": "Brown",
		"eyeColor": "Brown",
		"heightCategory": "Average",
		"outfitColor": "Green",
		"affiliation": "Mondstadt",
		"voiceActorJP": "Yuto Uemura"
	},
	{
		"id": "eula",
		"name": "Eula",
		"game": "Genshin Impact",
		"releaseDate": "2021-05-18",
		"rarity": "SSR",
		"gender": "Female",
		"species": { "type": "Human", "sub": "" },
		"hairColor": "Blonde",
		"eyeColor": "Blue",
		"heightCategory": "Average",
		"outfitColor": "Blue",
		"affiliation": "Mondstadt",
		"voiceActorJP": "Rie Murakawa"
	},
	{
		"id": "yelan",
		"name": "Yelan",
		"game": "Genshin Impact",
		"releaseDate": "2022-05-31",
		"rarity": "SSR",
		"gender": "Female",
		"species": { "type": "Human", "sub": "" },
		"hairColor": "Black",
		"eyeColor": "Blue",
		"heightCategory": "Tall",
		"outfitColor": "Blue",
		"affiliation": "Liyue",
		"voiceActorJP": "Yu Shimamura"
	}
]
