[
	{
		"id": "acheron",
		"name": "Acheron",
		"game": "Honkai: Star Rail",
		"releaseDate": "2024-04-17",
		"rarity": "SSR",
		"gender": "Female",
		"species": { "type": "Human", "sub": "" },
		"hairColor": "White",
		"eyeColor": "Purple",
		"heightCategory": "Tall",
		"outfitColor": "Black",
		"affiliation": "Astral Express",
		"voiceActorJP": "Ayane Sakura"
	},
	{
		"id": "bronya",
		"name": "Bronya",
		"game": "Honkai: Star Rail",
		"releaseDate": "2023-06-28",
		"rarity": "SSR",
		"gender": "Female",
		"species": { "type": "Human", "sub": "" },
		"hairColor": "White",
		"eyeColor": "Blue",
		"heightCategory": "Average",
		"outfitColor": "White",
		"affiliation": "Belobog",
		"voiceActorJP": "Ai Kayano"
	},
	{
		"id": "seele",
		"name": "Seele",
		"game": "Honkai: Star Rail",
		"releaseDate": "2023-04-26",
		"rarity": "SSR",
		"gender": "Female",
		"species": { "type": "Human", "sub": "" },
		"hairColor": "Purple",
		"eyeColor": "Red",
		"heightCategory": "Average",
		"outfitColor": "Purple",
		"affiliation": "Belobog",
		"voiceActorJP": "Yurika Kubo"
	},
	{
		"id": "welt",
		"name": "Welt",
		"game": "Honkai: Star Rail",
		"releaseDate": "2023-04-26",
		"rarity": "SSR",
		"gender": "Male",
		"species": { "type": "Human", "sub": "" },
		"hairColor": "White",
		"eyeColor": "Blue",
		"heightCategory": "Tall",
		"outfitColor": "Black",
		"affiliation": "Astral Express",
		"voiceActorJP": "Joji Nakata"
	},
	{
		"id": "herta",
		"name": "Herta",
		"game": "Honkai: Star Rail",
		"releaseDate": "2023-04-26",
		"rarity": "SR",
		"gender": "Female",
		"species": { "type": "Human", "sub": "" },
		"hairColor": "White",
		"eyeColor": "Blue",
		"heightCategory": "Short",
		"outfitColor": "White",
		"affiliation": "Herta Space Station",
		"voiceActorJP": "Misato Fukuen"
	}
]
